{
  "artifact_id": "RESEARCH-001-PUBLIC-SOURCE-REPRODUCTION",
  "schema_version": "2.0.0",
  "observed_at": "2026-08-02T01:36:04Z",
  "method": "metadata_and_schema_reproduction",
  "claim_ceiling": "Current official metadata/schema and narrow independently captured counterexamples only; no historical, coverage, identity-accuracy, predictive, causal, or authority claim.",
  "status": "pass",
  "probes": [
    {
      "probe_id": "PROBE-ON-PACKAGE",
      "source_id": "ON-SELECT",
      "acquisition_level": "metadata",
      "request": {
        "method": "GET",
        "url": "https://data.ontario.ca/api/3/action/package_show?id=5f0c3532-6e42-4ed7-a92c-ecde22bfea06",
        "argv": [
          "python",
          "scripts/capture_public_research_evidence.py",
          "--observed-at",
          "2026-08-02T01:36:04Z"
        ]
      },
      "runs": [
        {
          "role": "builder",
          "review_mode": "canonicalized_semantic_review",
          "observed_at": "2026-08-02T01:36:04Z",
          "success": true,
          "http_status": null,
          "content_type": "application/vnd.cre.canonical-json",
          "response_sha256": "a3b3ca247ecd8a218a623b314acd152c3979bd9f37aa30f54357e1a296ae2ec5",
          "reported_total": null,
          "schema_sha256": null,
          "rows_acquired": false
        },
        {
          "role": "independent_reviewer",
          "review_mode": "exact_http_capture",
          "observed_at": "2026-08-02T02:01:32.380865Z",
          "success": true,
          "http_status": 200,
          "content_type": "application/json;charset=utf-8",
          "response_sha256": "2e1350e3ddb627d88932b8eaf3de958376021bf873e22485e4cbb4becc65e307",
          "reported_total": null,
          "schema_sha256": null,
          "rows_acquired": false
        }
      ],
      "observations": {
        "license_id": "OGL-ON-1.0",
        "current_as_of": "2026-07-01",
        "schema_fields": [],
        "history_proven": false,
        "authority_granted": false
      },
      "claim_ceiling": "Current publisher response only; no row acquisition, history, coverage, or authority claim."
    },
    {
      "probe_id": "PROBE-ON-SCHEMA",
      "source_id": "ON-SELECT",
      "acquisition_level": "schema",
      "request": {
        "method": "GET",
        "url": "https://data.ontario.ca/api/3/action/datastore_search?resource_id=5a4f44a7-c656-4977-b4d0-91bedaa0ea06&limit=0",
        "argv": [
          "python",
          "scripts/capture_public_research_evidence.py",
          "--observed-at",
          "2026-08-02T01:36:04Z"
        ]
      },
      "runs": [
        {
          "role": "builder",
          "review_mode": "canonicalized_semantic_review",
          "observed_at": "2026-08-02T01:36:04Z",
          "success": true,
          "http_status": null,
          "content_type": "application/vnd.cre.canonical-json",
          "response_sha256": "315928ca3d460a104f10019a5000dbc2a3384421fba4a900c9e3922eac72f0c5",
          "reported_total": 681,
          "schema_sha256": "4c2b9c4de9d7f7ad0b7c952eb6ba3097f0fe2ae3ca9090c5a85fdd54faa21434",
          "rows_acquired": false
        },
        {
          "role": "independent_reviewer",
          "review_mode": "exact_http_capture",
          "observed_at": "2026-08-02T02:01:32.617483Z",
          "success": true,
          "http_status": 200,
          "content_type": "application/json;charset=utf-8",
          "response_sha256": "5ad71bbc561123b208cb6a53d486af02222bf4886b99d86080b87aefa63dde3e",
          "reported_total": 681,
          "schema_sha256": "4c2b9c4de9d7f7ad0b7c952eb6ba3097f0fe2ae3ca9090c5a85fdd54faa21434",
          "rows_acquired": false
        }
      ],
      "observations": {
        "license_id": "OGL-ON-1.0",
        "current_as_of": "2026-07-01",
        "schema_fields": [
          "_id:int",
          "Legal Name:text",
          "Operating name:text",
          "Address:text",
          "City:text",
          "Province:text",
          "Postal code:text",
          "Country:text",
          "Telephone:text",
          "Website:text",
          "Email:text",
          "Licence type:text",
          "Licence number:numeric",
          "Licence status:text",
          "Expiry date:text"
        ],
        "history_proven": false,
        "authority_granted": false
      },
      "claim_ceiling": "Current publisher response only; no row acquisition, history, coverage, or authority claim."
    },
    {
      "probe_id": "PROBE-TOR-PACKAGE",
      "source_id": "TOR-COA",
      "acquisition_level": "metadata",
      "request": {
        "method": "GET",
        "url": "https://ckan0.cf.opendata.inter.prod-toronto.ca/api/3/action/package_show?id=committee-of-adjustment-applications",
        "argv": [
          "python",
          "scripts/capture_public_research_evidence.py",
          "--observed-at",
          "2026-08-02T01:36:04Z"
        ]
      },
      "runs": [
        {
          "role": "builder",
          "review_mode": "canonicalized_semantic_review",
          "observed_at": "2026-08-02T01:36:04Z",
          "success": true,
          "http_status": null,
          "content_type": "application/vnd.cre.canonical-json",
          "response_sha256": "b07e02ef088c629e301902a4488fea739a39118994f515b171551fafa215168b",
          "reported_total": null,
          "schema_sha256": null,
          "rows_acquired": false
        },
        {
          "role": "independent_reviewer",
          "review_mode": "exact_http_capture",
          "observed_at": "2026-08-02T02:01:32.978353Z",
          "success": true,
          "http_status": 200,
          "content_type": "application/json;charset=utf-8",
          "response_sha256": "1b1868fcc8f399a9c455a68c7dc326654d14e34eb203ce29bf0dc4eb6396fe17",
          "reported_total": null,
          "schema_sha256": null,
          "rows_acquired": false
        }
      ],
      "observations": {
        "license_id": "open-government-licence-toronto",
        "current_as_of": null,
        "schema_fields": [],
        "history_proven": false,
        "authority_granted": false
      },
      "claim_ceiling": "Current publisher response only; no row acquisition, history, coverage, or authority claim."
    },
    {
      "probe_id": "PROBE-TOR-ACTIVE",
      "source_id": "TOR-COA",
      "acquisition_level": "schema",
      "request": {
        "method": "GET",
        "url": "https://ckan0.cf.opendata.inter.prod-toronto.ca/api/3/action/datastore_search?resource_id=51fd09cd-99d6-430a-9d42-c24a937b0cb0&limit=0",
        "argv": [
          "python",
          "scripts/capture_public_research_evidence.py",
          "--observed-at",
          "2026-08-02T01:36:04Z"
        ]
      },
      "runs": [
        {
          "role": "builder",
          "review_mode": "canonicalized_semantic_review",
          "observed_at": "2026-08-02T01:36:04Z",
          "success": true,
          "http_status": null,
          "content_type": "application/vnd.cre.canonical-json",
          "response_sha256": "e06502faaab58e8997f2b6ac84b973560175c19c9c868bd20be9e16539f6cf6d",
          "reported_total": 2903,
          "schema_sha256": "a5e5cb72ed4067902c6baef637318be6e59e1efaea0413a9fadabc1c636c6d66",
          "rows_acquired": false
        },
        {
          "role": "independent_reviewer",
          "review_mode": "exact_http_capture",
          "observed_at": "2026-08-02T02:01:33.475596Z",
          "success": true,
          "http_status": 200,
          "content_type": "application/json;charset=utf-8",
          "response_sha256": "b546747385ce1c2d113ca69ed5205f42575add25160b097a744346e6460a5622",
          "reported_total": 2903,
          "schema_sha256": "a5e5cb72ed4067902c6baef637318be6e59e1efaea0413a9fadabc1c636c6d66",
          "rows_acquired": false
        }
      ],
      "observations": {
        "license_id": "open-government-licence-toronto",
        "current_as_of": null,
        "schema_fields": [
          "_id:int",
          "SYS_ID:text",
          "APPLICATION_TYPE:text",
          "IN_DATE:text",
          "PLANNING_DISTRICT:text",
          "WARD:text",
          "STREET_NUM:text",
          "STREET_NAME:text",
          "STREET_TYPE:text",
          "STREET_DIRECTION:text",
          "POSTAL:text",
          "REFERENCE_FILE#:text",
          "SUB_TYPE:text",
          "WORK_TYPE:text",
          "ZONING_REVIEW:text",
          "ZONING_DESIGNATION:text",
          "COMMUNITY:text",
          "EMPLOYMENT_DISTRICT:text",
          "DESCRIPTION:text",
          "HEARING_DATE:date",
          "TIME_OF_MEETING:text",
          "MEETING_LOCATION:text",
          "C_OF_A_DESCISION:text",
          "ANYONE_OBJECT_AT_MEETING:text",
          "APPEAL_EXPIRY_DATE:date",
          "OMB_ORDER_DATE:text",
          "OMB_DESCISION:text",
          "NUMBER_OF_LOTS_CREATED:text",
          "CONDITION_EXPIRY_DATE:text",
          "STATUSDESC:text"
        ],
        "history_proven": false,
        "authority_granted": false
      },
      "claim_ceiling": "Current publisher response only; no row acquisition, history, coverage, or authority claim."
    },
    {
      "probe_id": "PROBE-TOR-CLOSED",
      "source_id": "TOR-COA",
      "acquisition_level": "schema",
      "request": {
        "method": "GET",
        "url": "https://ckan0.cf.opendata.inter.prod-toronto.ca/api/3/action/datastore_search?resource_id=9c97254e-5460-4799-896f-c7823413c81c&limit=0",
        "argv": [
          "python",
          "scripts/capture_public_research_evidence.py",
          "--observed-at",
          "2026-08-02T01:36:04Z"
        ]
      },
      "runs": [
        {
          "role": "builder",
          "review_mode": "canonicalized_semantic_review",
          "observed_at": "2026-08-02T01:36:04Z",
          "success": true,
          "http_status": null,
          "content_type": "application/vnd.cre.canonical-json",